{
  "$schema": "https://json-schema.org/draft/2020-12/schema",
  "title": "UBP Domain Expert Registry v1",
  "type": "object",
  "additionalProperties": false,
  "required": [
    "kind",
    "version",
    "ubpRevision",
    "graphSourceRevision",
    "entries"
  ],
  "properties": {
    "kind": {
      "const": "domain-expert-registry"
    },
    "version": {
      "const": 1
    },
    "ubpRevision": {
      "type": "string",
      "minLength": 1,
      "pattern": "\\S"
    },
    "graphSourceRevision": {
      "type": "string",
      "minLength": 1,
      "pattern": "\\S"
    },
    "entries": {
      "type": "array",
      "minItems": 1,
      "uniqueItems": true,
      "items": {
        "type": "object",
        "additionalProperties": false,
        "required": [
          "expertId",
          "status"
        ],
        "properties": {
          "expertId": {
            "type": "string",
            "pattern": "^[a-z][a-z0-9]*(?:-[a-z0-9]+)*$"
          },
          "status": {
            "type": "string",
            "pattern": "^(candidate|active|suspended|retired)$"
          },
          "accountableOwner": {
            "type": "string",
            "minLength": 1,
            "pattern": "\\S"
          },
          "backupOwner": {
            "type": "string",
            "minLength": 1,
            "pattern": "\\S"
          },
          "approvedBy": {
            "type": "string",
            "minLength": 1,
            "pattern": "\\S"
          },
          "approvedRevision": {
            "type": "string",
            "minLength": 1,
            "pattern": "\\S"
          },
          "manifestSha256": {
            "type": "string",
            "pattern": "^[a-f0-9]{64}$"
          },
          "reviewDueAt": {
            "type": "string",
            "pattern": "^\\d{4}-\\d{2}-\\d{2}T\\d{2}:\\d{2}:\\d{2}(?:\\.\\d{3})?Z$"
          },
          "seedGraphRevision": {
            "type": "string",
            "minLength": 1,
            "pattern": "\\S"
          },
          "seedVerificationSha256": {
            "type": "string",
            "pattern": "^[a-f0-9]{64}$"
          },
          "blockedActions": {
            "type": "array",
            "uniqueItems": true,
            "items": {
              "type": "string",
              "pattern": "^[a-z][a-z0-9]*(?:-[a-z0-9]+)*$"
            }
          }
        }
      }
    }
  }
}
