{
  "kind": "domain-expert-registry",
  "version": 1,
  "ubpRevision": "ebf1c845bdf917d821f3182bff0cbe04c21d2c8e",
  "graphSourceRevision": "ebf1c845bdf917d821f3182bff0cbe04c21d2c8e",
  "entries": [
    {
      "expertId": "control-plane-expert",
      "status": "active",
      "accountableOwner": "capa-governance:control-plane-expert",
      "backupOwner": "santiago-product-owner",
      "approvedBy": "santiago-product-owner",
      "approvedRevision": "3a836bcf1d212b5e9a67d19d1e47ecf34236cdbd",
      "manifestSha256": "697de1a6f85af23195a896a600da5e19cc4fc528e7852eed5f53ec71af81f9ae",
      "reviewDueAt": "2027-03-08T23:59:59Z",
      "seedGraphRevision": "ebf1c845bdf917d821f3182bff0cbe04c21d2c8e",
      "seedVerificationSha256": "ac113ee044d152396cfb659cf3c51f97a876b83c2eb266939a2c5cb0ea377ef4",
      "blockedActions": [
        "declare-control-plane-sovereign"
      ]
    },
    {
      "expertId": "ledger-expert",
      "status": "active",
      "accountableOwner": "capa-governance:ledger-expert",
      "backupOwner": "santiago-product-owner",
      "approvedBy": "santiago-product-owner",
      "approvedRevision": "4e188dcbebbdbcd009c3beac64355d7ae3fe1d10",
      "manifestSha256": "a070f0b8ae8938d21dc8ea1fa002e1287ac1496eccb44965c59c98bd2b350f71",
      "reviewDueAt": "2027-03-08T23:59:59Z",
      "seedGraphRevision": "ebf1c845bdf917d821f3182bff0cbe04c21d2c8e",
      "seedVerificationSha256": "6bfc17c30cd6317137c92749a1014ca86eac778114a8dc9145548f7eadde7d40",
      "blockedActions": [
        "declare-ledger-country-sovereign"
      ]
    },
    {
      "expertId": "tax-expert",
      "status": "active",
      "accountableOwner": "capa-governance:tax-expert",
      "backupOwner": "santiago-product-owner",
      "approvedBy": "santiago-product-owner",
      "approvedRevision": "5725679bba8d2397b3236bc8b2bfef416b63f8cc",
      "manifestSha256": "ad1fb00d963a6d27dfdefc64e38183aa899688661a37ce876a0c07a5c66e5cf6",
      "reviewDueAt": "2027-01-07T23:59:59Z",
      "seedGraphRevision": "ebf1c845bdf917d821f3182bff0cbe04c21d2c8e",
      "seedVerificationSha256": "7dff441c70e6c14320973c825c41b2c66d1358835c854b8385fef0bb5ffa078c",
      "blockedActions": []
    },
    {
      "expertId": "identity-access-expert",
      "status": "active",
      "accountableOwner": "capa-governance:identity-access-expert",
      "backupOwner": "santiago-product-owner",
      "approvedBy": "santiago-product-owner",
      "approvedRevision": "f9d1b5cd8214cb86f016ca565923e7e16147ee3e",
      "manifestSha256": "53e3d001903ae244f9f7a40a24c035a748d272a088f3608775155e415beb2e4c",
      "reviewDueAt": "2027-03-09T23:59:59Z",
      "seedGraphRevision": "ebf1c845bdf917d821f3182bff0cbe04c21d2c8e",
      "seedVerificationSha256": "77316ffeee801bec7a2eb6ba9422bfef2d61146d61c9415a50e57b88ba379f09",
      "blockedActions": [
        "declare-data-layer-tenant-isolation-complete",
        "declare-fine-grained-authorization-complete",
        "enable-cross-tenant-access",
        "enable-break-glass"
      ]
    },
    {
      "expertId": "audit-integrity-expert",
      "status": "active",
      "accountableOwner": "capa-governance:audit-integrity-expert",
      "backupOwner": "santiago-product-owner",
      "approvedBy": "santiago-product-owner",
      "approvedRevision": "551f1398465c385927b6cb2bffcec552dc0c2281",
      "manifestSha256": "a2f693e755112b86ce5aaa9177295766bb2d2a0f0be527930e0ba25c27320f0e",
      "reviewDueAt": "2027-03-09T23:59:59Z",
      "seedGraphRevision": "ebf1c845bdf917d821f3182bff0cbe04c21d2c8e",
      "seedVerificationSha256": "3f39e1dad5c2db77a40e0236fb12274c9c5bb739ea6721b227cc9448dd95f79f",
      "blockedActions": [
        "declare-audit-read-model-complete",
        "declare-cross-service-audit-coverage-complete",
        "declare-sod-complete",
        "declare-worm-retention-complete"
      ]
    },
    {
      "expertId": "tenant-organization-expert",
      "status": "active",
      "accountableOwner": "capa-governance:tenant-organization-expert",
      "backupOwner": "santiago-product-owner",
      "approvedBy": "santiago-product-owner",
      "approvedRevision": "b12623662d6ab0313733b3abd8cb1d4c720adfcc",
      "manifestSha256": "f2fc3cc59d1e38cd2274014a5fabc00c03f02064a2bee3f8dd9ec39555f69229",
      "reviewDueAt": "2027-03-09T23:59:59Z",
      "seedGraphRevision": "ebf1c845bdf917d821f3182bff0cbe04c21d2c8e",
      "seedVerificationSha256": "e92708a39902d5350a2df9acb200be1dce3ebf81c2860e3e601e66f152ecbff8",
      "blockedActions": [
        "declare-intercompany-complete",
        "declare-legal-entity-compatibility-retired",
        "declare-shared-master-policy-complete",
        "declare-tenant-organization-migration-complete"
      ]
    },
    {
      "expertId": "localization-country-pack-expert",
      "status": "active",
      "accountableOwner": "capa-governance:localization-country-pack-expert",
      "backupOwner": "santiago-product-owner",
      "approvedBy": "santiago-product-owner",
      "approvedRevision": "d7bb165f3f822fd226de62876f4ed69ebfdff3e5",
      "manifestSha256": "564344b332b3b0af2458befd2d9e2216c5af727310d512e323885b173252282b",
      "reviewDueAt": "2027-03-09T23:59:59Z",
      "seedGraphRevision": "ebf1c845bdf917d821f3182bff0cbe04c21d2c8e",
      "seedVerificationSha256": "6181f6a9b34c00609be2db7c0294c7485f3438f813235dd7da304a9d1ee5f008",
      "blockedActions": [
        "declare-country-supported",
        "declare-cross-service-install-complete",
        "declare-country-pack-migration-complete",
        "declare-country-pack-sovereign"
      ]
    },
    {
      "expertId": "legal-numbering-expert",
      "status": "active",
      "accountableOwner": "capa-governance:legal-numbering-expert",
      "backupOwner": "santiago-product-owner",
      "approvedBy": "santiago-product-owner",
      "approvedRevision": "e99e51749094ed2953836f9a62e2e60d4d675b16",
      "manifestSha256": "0b7ba7439c87fd3f6abc56500590416d61562159c3574caabe360c0c5a3ecfa1",
      "reviewDueAt": "2027-03-10T23:59:59Z",
      "seedGraphRevision": "ebf1c845bdf917d821f3182bff0cbe04c21d2c8e",
      "seedVerificationSha256": "6389182e35844bf40b5885d631a1b8de28bf9244a44cda3ccbbdd9a2a6015157",
      "blockedActions": [
        "declare-gapless-concurrency-complete",
        "declare-country-pack-numbering-integration-complete",
        "declare-scoped-numbering-complete",
        "declare-void-cancellation-complete",
        "declare-legal-numbering-sovereign"
      ]
    },
    {
      "expertId": "electronic-fiscal-documents-expert",
      "status": "active",
      "accountableOwner": "capa-governance:electronic-fiscal-documents-expert",
      "backupOwner": "santiago-product-owner",
      "approvedBy": "santiago-product-owner",
      "approvedRevision": "5e81c1d1d59967d75d5031866cf119eeef857c2b",
      "manifestSha256": "d22d9e39c13ca9f382a15a0dd6219a21b82a84823aa7e485f7df14928d7e1201",
      "reviewDueAt": "2027-03-10T23:59:59Z",
      "seedGraphRevision": "ebf1c845bdf917d821f3182bff0cbe04c21d2c8e",
      "seedVerificationSha256": "e1c834374a7abddcd5dafbfee059ce9fb4b144c6036aa6078f88d4a0c67397ea",
      "blockedActions": [
        "declare-provider-contract-real",
        "declare-idempotent-reconciliation-complete",
        "declare-country-document-coverage-complete",
        "declare-fiscal-artifact-integrity-complete",
        "declare-electronic-fiscal-documents-e2e",
        "declare-country-supported"
      ]
    },
    {
      "expertId": "fx-expert",
      "status": "active",
      "accountableOwner": "capa-governance:fx-expert",
      "backupOwner": "santiago-product-owner",
      "approvedBy": "santiago-product-owner",
      "approvedRevision": "06b23799a6387c76d9f99b3ceba1b3c44283ceb4",
      "manifestSha256": "99869b7b4dc6f6300f2f8f30c5db3b6e1d5280113fff4586714d089086f71500",
      "reviewDueAt": "2027-03-10T23:59:59Z",
      "seedGraphRevision": "ebf1c845bdf917d821f3182bff0cbe04c21d2c8e",
      "seedVerificationSha256": "5e152a5b9cd22a92808f2d2d68939eec64c7f99b32909b921f218a4a7edd0068",
      "blockedActions": [
        "declare-fx-adr-accepted",
        "declare-fx-master-complete",
        "declare-multicurrency-posting-complete",
        "declare-realized-fx-complete",
        "declare-unrealized-revaluation-complete",
        "declare-fx-runtime-ready",
        "enable-commercial-multicurrency"
      ]
    },
    {
      "expertId": "treasury-expert",
      "status": "active",
      "accountableOwner": "capa-governance:treasury-expert",
      "backupOwner": "santiago-product-owner",
      "approvedBy": "santiago-product-owner",
      "approvedRevision": "9c878554390e46f35e9397a0e9cff5d7a16c1399",
      "manifestSha256": "ce6112246525e4b9b1f2f903375b6d61f9ce93ac0f848bd6441d850122f14230",
      "reviewDueAt": "2027-03-10T23:59:59Z",
      "seedGraphRevision": "ebf1c845bdf917d821f3182bff0cbe04c21d2c8e",
      "seedVerificationSha256": "b1582640832330361ad28eb69f03cccdf5a2336f7f4b90219d56d1fc8ba6bc32",
      "blockedActions": [
        "declare-treasury-adr-accepted",
        "declare-treasury-service-complete",
        "declare-money-lifecycle-complete",
        "declare-payment-four-eyes-complete",
        "declare-bank-reconciliation-complete",
        "declare-treasury-runtime-ready",
        "execute-payment"
      ]
    },
    {
      "expertId": "document-management-expert",
      "status": "active",
      "accountableOwner": "capa-governance:document-management-expert",
      "backupOwner": "santiago-product-owner",
      "approvedBy": "santiago-product-owner",
      "approvedRevision": "ec902ceaedcd4735371cc7c83679c354150dc5c6",
      "manifestSha256": "6f2748acbee935666c2a19e94bdbadceac105cb011f1aa50b3ccf870b27281a7",
      "reviewDueAt": "2027-03-10T23:59:59Z",
      "seedGraphRevision": "ebf1c845bdf917d821f3182bff0cbe04c21d2c8e",
      "seedVerificationSha256": "4444edac4bda6f4624fe22b96a990e91e5a4a97e02d74b76b835181a0c263575",
      "blockedActions": [